{
  "schema_version": "2.0",
  "session_id": "d6d9e5b7-c9bc-4eb1-ae4a-1a14ed5b1350",
  "event_count": 8,
  "meaningful_event_count": 8,
  "timeline": [
    {
      "offset_seconds": 0.0,
      "event_type": "session_started",
      "summary": "Approved CAD session started",
      "source_event_id": "f74d30dd-9945-4291-8ae9-95658379b335"
    },
    {
      "offset_seconds": 5.0,
      "event_type": "drawing_opened",
      "summary": "Drawing opened",
      "source_event_id": "1e6e2db8-c50a-4cd2-b122-381e3f20640f"
    },
    {
      "offset_seconds": 20.0,
      "event_type": "cad_command",
      "summary": "AutoCAD command: LINE",
      "source_event_id": "9ef08077-1fd0-468c-bf68-1f8f1ef23c4e"
    },
    {
      "offset_seconds": 35.0,
      "event_type": "cad_command",
      "summary": "AutoCAD command: TRIM",
      "source_event_id": "7482f72e-0b68-4535-bf65-f234a460e376"
    },
    {
      "offset_seconds": 40.0,
      "event_type": "cad_command",
      "summary": "AutoCAD command: LINE",
      "source_event_id": "4d2d4b2c-7e11-4b5e-9c20-1e5f6a7b8c90"
    },
    {
      "offset_seconds": 45.0,
      "event_type": "cad_command",
      "summary": "AutoCAD command: TRIM",
      "source_event_id": "5e3e5c3d-8f22-4c6f-a031-2f6a7b8c9d01"
    },
    {
      "offset_seconds": 50.0,
      "event_type": "drawing_saved",
      "summary": "Drawing saved",
      "source_event_id": "a21f79d6-cb3c-41c4-b5f0-1f0a883fde45"
    },
    {
      "offset_seconds": 60.0,
      "event_type": "session_ended",
      "summary": "Approved CAD session ended",
      "source_event_id": "3cb65614-3f9d-4e19-bac1-133fbdda9a54"
    }
  ],
  "operation_segments": [
    {
      "sequence": 1,
      "start_offset_seconds": 20.0,
      "end_offset_seconds": 20.0,
      "command_names": [
        "LINE"
      ],
      "drawing_ref": "synthetic-drawing-001",
      "summary": "AutoCAD command: LINE",
      "source_event_ids": [
        "9ef08077-1fd0-468c-bf68-1f8f1ef23c4e"
      ]
    },
    {
      "sequence": 2,
      "start_offset_seconds": 35.0,
      "end_offset_seconds": 35.0,
      "command_names": [
        "TRIM"
      ],
      "drawing_ref": "synthetic-drawing-001",
      "summary": "AutoCAD command: TRIM",
      "source_event_ids": [
        "7482f72e-0b68-4535-bf65-f234a460e376"
      ]
    },
    {
      "sequence": 3,
      "start_offset_seconds": 40.0,
      "end_offset_seconds": 40.0,
      "command_names": [
        "LINE"
      ],
      "drawing_ref": "synthetic-drawing-001",
      "summary": "AutoCAD command: LINE",
      "source_event_ids": [
        "4d2d4b2c-7e11-4b5e-9c20-1e5f6a7b8c90"
      ]
    },
    {
      "sequence": 4,
      "start_offset_seconds": 45.0,
      "end_offset_seconds": 45.0,
      "command_names": [
        "TRIM"
      ],
      "drawing_ref": "synthetic-drawing-001",
      "summary": "AutoCAD command: TRIM",
      "source_event_ids": [
        "5e3e5c3d-8f22-4c6f-a031-2f6a7b8c9d01"
      ]
    }
  ],
  "keyframes": [],
  "warnings": [],
  "output_object_key": "sessions/d6d9e5b7-c9bc-4eb1-ae4a-1a14ed5b1350/timeline-v2.json",
  "idempotency_key": "95f800f086107f9ae862b88f04a167c238cd964aa81f832ad63f23f3a250146d"
}
